<?xml version="1.0" encoding="UTF-8"?>
<LIBRERIE xmlns:xsi="http://www.w3.org/2001/XMLSchema-instance" xsi:noNamespaceSchemaLocation="SchemaLibrerie.xsd"><Libreria utenteAssociato="CosmoVellucci"><id>31</id><id>2</id></Libreria><Libreria utenteAssociato="Manigoldo"><id>2</id></Libreria><Libreria utenteAssociato="Arturo"><id>25</id><id>77</id><id>2</id></Libreria><Libreria utenteAssociato="Bramante"/></LIBRERIE>
